{
  "$schema": "./desk.schema.json",
  "updated": "2026-09-25T09:40:00Z",
  "glossary": [
    {
      "term": "wc-3",
      "summary": "Epic: count words, not only lines (`wordcount -w`). wc-3.1 landed; wc-3.2 waits on the owner."
    },
    {
      "term": "wc-4",
      "summary": "Epic: the user guide, assigned to the docs worker."
    },
    {
      "term": "CR_PROFILE",
      "summary": "The environment variable that names a worker's profile. The agent's instructions read it to know which worker they are."
    },
    {
      "term": "e2b",
      "aliases": [
        "E2B"
      ],
      "summary": "A service that runs isolated cloud sandboxes, used as one of the runners (runners/e2b)."
    },
    {
      "term": "setup script",
      "summary": "The script a cloud environment runs before the agent starts. It installs tools and must exit zero."
    }
  ],
  "idPattern": "wc-\\d+(?:\\.\\d+)*",
  "cards": [
    {
      "id": "env-docs",
      "kind": "action",
      "title": "Create the cloud environment for the docs worker",
      "why": "The docs worker cannot start without its environment. Epic wc-4 (the user guide) waits on it.",
      "context": "One environment per worker profile. It holds the profile name as a variable and a setup script that installs the tools the checks need. Nothing secret goes in it: anyone who uses the environment can read its variables and script.",
      "steps": [
        "Open claude.ai/code, then Settings → Cloud environments → Add cloud environment.",
        "Name: wordcount-docs. Network access: Trusted.",
        "Environment variables: paste the first text below.",
        "Setup script: paste the second text below, whole. Do not replace it with a line that runs a file from the repository.",
        "Save, start a session in this environment, and paste the opening message the coordinator gives you.",
        "Mark this card answered with the new session's URL in the note."
      ],
      "texts": [
        {
          "label": "Environment variables (.env format)",
          "text": "CR_PROFILE=docs\n"
        },
        {
          "label": "Setup script",
          "text": "#!/bin/bash\n# control-room: setup script for the docs profile. Paste whole.\nset -u\nlog() { printf 'control-room setup: %s\\n' \"$*\"; }\nif ! command -v jq >/dev/null 2>&1; then\n\t(apt-get update -qq && apt-get install -y -qq jq) || log \"jq install failed\"\nfi\npython3 -c 'import jsonschema' 2>/dev/null ||\n\tpython3 -m pip install -q --break-system-packages jsonschema || log \"jsonschema install failed\"\n(apt-get install -y -qq shellcheck bats || log \"shellcheck/bats failed\") &\nwait\nlog \"done for profile ${CR_PROFILE:-<unset>}\"\nexit 0\n"
        }
      ],
      "links": [
        {
          "label": "Configure cloud environments",
          "url": "https://code.claude.com/docs/en/cloud-environments"
        },
        {
          "label": "The runner's README",
          "url": "https://github.com/NoeticEcho/control-room/blob/main/runners/claude-code-cloud/README.md"
        }
      ],
      "status": "open",
      "created": "2026-09-25T09:10:00Z",
      "source": "coordinator: epic wc-4 is assigned to profile docs, which has no session"
    },
    {
      "id": "release-0-2",
      "kind": "decision",
      "title": "Three calls before releasing wordcount 0.2",
      "why": "The docs worker (wc-4) writes the release notes once these are answered.",
      "context": [
        "wc-3.1 (count words) has landed; wc-3.2 (any space separates words) waits on its own card. The release can go out with -w as it is.",
        "A package registry means one more account for you to hold, and one more place to publish on every release.",
        "Q3 costs one E2B run of about two minutes, on your key."
      ],
      "questions": [
        {
          "id": "Q1",
          "text": "Which version number for the release that adds -w?",
          "options": [
            {
              "key": "a",
              "label": "0.2.0",
              "recommended": true
            },
            {
              "key": "b",
              "label": "1.0.0: call it stable"
            }
          ]
        },
        {
          "id": "Q2",
          "text": "Where can people download it?",
          "options": [
            {
              "key": "a",
              "label": "The release page only",
              "recommended": true
            },
            {
              "key": "b",
              "label": "The release page and a package registry"
            }
          ]
        },
        {
          "id": "Q3",
          "text": "Smoke-test the release in an e2b sandbox before tagging?",
          "options": [
            {
              "key": "a",
              "label": "Yes, once"
            },
            {
              "key": "b",
              "label": "No, CI is enough",
              "recommended": true
            }
          ]
        }
      ],
      "status": "open",
      "created": "2026-09-25T09:20:00Z",
      "source": "coordinator: release checklist for 0.2"
    },
    {
      "id": "wc-3-unicode",
      "kind": "decision",
      "title": "How should wc count words in text that is not ASCII?",
      "why": "Epic wc-3 (count words) is ready except for this; the worker counted ASCII only and asked.",
      "context": "Today `wc` splits on ASCII spaces. Text with non-breaking spaces or in scripts without spaces (Chinese, Japanese) counts oddly. The fix is small either way; the choice is what users are promised.",
      "choices": [
        {
          "id": "unicode-spaces",
          "label": "Split on every Unicode space",
          "consequence": "Matches what most people expect for European text. Scripts without spaces still count as one word per run. One more test.",
          "recommended": true
        },
        {
          "id": "ascii-only",
          "label": "Keep ASCII spaces only, and document it",
          "consequence": "No code change. The README says what counts as a word."
        },
        {
          "id": "segmenter",
          "label": "Use a word segmenter library",
          "consequence": "Correct for every script, but the tool gains its first dependency."
        }
      ],
      "links": [
        {
          "label": "The worker's question in the handoff",
          "url": "https://git.example.invalid/wordcount/blob/claude/wc-3-count-words/handoff/wc-3.json"
        }
      ],
      "answer": {
        "choice": "unicode-spaces",
        "note": "Yes, and say in the README that scripts without spaces are not segmented.",
        "at": "2026-09-25T09:32:00Z"
      },
      "status": "answered",
      "created": "2026-09-25T08:55:00Z",
      "source": "handoff wc-3, questions[0]"
    },
    {
      "id": "licence-sample",
      "kind": "decision",
      "title": "May the test fixtures include a paragraph of a published novel?",
      "why": "The docs worker wants real prose in the examples. It stopped rather than guess about the licence.",
      "context": "The paragraph would be about 80 words from a book still under copyright. A public-domain text works as well for the tests.",
      "answer": {
        "note": "No. Use the first paragraph of a public-domain text and name its source in the fixture.",
        "at": "2026-09-24T17:05:00Z"
      },
      "status": "done",
      "resolution": "Relayed to the docs worker in its next brief; it used a public-domain paragraph and named the source. Landed with epic wc-2.",
      "created": "2026-09-24T16:20:00Z",
      "source": "handoff wc-2, questions[0]"
    }
  ]
}
